URN,Label,Description,Status,Redirect
urn:cite:hmt:astro.1,Orion,"constellation located on the celestial equator,named for a famed hunter in Greek myth",proposed,
urn:cite:hmt:astro.2,Ophiuchus,"constellation located near the celestial equator,named the Serpentbearer",proposed,
urn:cite:hmt:astro.3,Pleiades,"group of seven stars located in Taurus",proposed,
urn:cite:hmt:astro.4,Hyades,"seven stars in the head of the Bull",proposed,
urn:cite:hmt:astro.5,Bear,"the constellation of the Great Bear, also known as the Wain, Wagon or Plough",proposed,
urn:cite:hmt:astro.6,Taurus,"The Bull, one of the constellations of the Zodiac",proposed,
urn:cite:hmt:astro.7,Atlas,"a star within the Pleiades",proposed,
urn:cite:hmt:astro.8,Scorpius,"The Scorpion, a constellation in located in the southern hemisphere near the center of the Milky Way",proposed,
urn:cite:hmt:astro.9,Celestial Poles,"the two imaginary points in the sky where the Earth's axis of rotation intersects the celestial sphere",proposed,
